timestamp,headline,source,summary,url,category,related
2026-03-12T13:00:02+00:00,"Amid Middle East conflict and new tax incentives, more family offices look to Hong Kong",CNBC,Hong Kong's latest proposed incentives for family offices include tax breaks on gold and bitcoin.,https://www.cnbc.com/2026/03/12/middle-east-conflict-new-tax-breaks-family-offices-hong-kong.html,business,
2026-03-12T12:59:00+00:00,Jim Cramer's top 10 things to watch in the stock market Thursday,CNBC,Oil prices are rallying despite a major release of strategic crude stockpiles.,https://www.cnbc.com/2026/03/12/jim-cramers-top-10-things-to-watch-in-the-stock-market-thursday.html,top news,
2026-03-12T12:55:00+00:00,Jobless claims show sluggish but stable labor market,MarketWatch,,https://www.marketwatch.com/story/jobless-claims-show-sluggish-but-stable-labor-market-3ea5d655,top news,
2026-03-12T11:58:52+00:00,Nintendo has jumped 18% this week as a surprise Pokémon hit drove hope it could boost Switch 2 sales,CNBC,"""Pokémon Pokopia"" is only available on the Switch 2, with Nintendo's share price rally this week built on hopes this might drive sales of the flagship console.",https://www.cnbc.com/2026/03/12/pokemon-pokopia-nintendo-share-price-rise-switch-2.html,top news,
2026-03-12T10:55:38+00:00,Poland says foiled cyberattack on nuclear centre may have come from Iran - Reuters,Reuters,Poland says foiled cyberattack on nuclear centre may have come from Iran  Reuters,https://news.google.com/rss/articles/CBMiqgFBVV95cUxNYnhnVkF1My1SQkt1UDRJRjE0MTRIb21mdmRrSG42RGs0M2lRaGVSWm5YMjBLN01Nc0VIZWliZFNtdHFSZDhsWUJFSTAxOVdBRUpOaG1aMjdBRnVEU1lkZVhfZ0JjQ3I5Z3Jya210NEJIRENSUHZEdXB1NHVCNVM5TXo2OTZxd3RLbTJPLW9WV0x1U19EeVRocHNYd0x3VllCUEQxZkF4ZnFSZw?oc=5,business,
2026-03-12T10:53:41+00:00,Israeli military says it targeted site used in Iran's nuclear programme - Reuters,Reuters,Israeli military says it targeted site used in Iran's nuclear programme  Reuters,https://news.google.com/rss/articles/CBMivgFBVV95cUxQOW4xbURhdldGcWJPV0cwZ3d2MWl1TlhmSG4zWnpPd0s1dWd6LVJxdzNsbWtPU2NBejZLNzVrTjZ5Nk41XzdnMTNjNk9sMmdWT2ZMeWIydTUtZjVZSkVESUpJZjJtSGhMYWU0VzZGNWg3QkVIb21zN0VtNVBkMGV5WXVtTGVRYUxuY1lJWHVOd1JlbFVQMWZINEpDeVpmOHhPZDhQWG84VWFUVnZ0cXFkYlFkalZWVjczM25UeHFB?oc=5,business,
2026-03-12T10:52:26+00:00,"Up to 3.2 million people displaced inside Iran by conflict, UN says - Reuters",Reuters,"Up to 3.2 million people displaced inside Iran by conflict, UN says  Reuters",https://news.google.com/rss/articles/CBMitwFBVV95cUxPdjRIdk1HbGRkVzZOR2ltdlcyU3R5TnBwSjJJbUFpMXc5NTZCQ0szSzZiTGpsVjZFejk5TTlKRWdheEJjQUlQVUx4ZnBYb1AyTEpxbVdCSWh2YmdKMjJmQl94QmZXMDJEZF9SOTUxaXdDR0pKTGh5ZEk1Wkk3VC1taVEzdTg3Mnd6SHgxQWFoR2N4SFZUejlmRWQ5RnF5bGZWZ3NvTFFWYXFpaTRuNEc4cmtBcnR6VzA?oc=5,business,
2026-03-12T10:41:14+00:00,India’s consumer inflation rises to 3.2% in February as oil risks loom,CNBC,India's inflation for February is within central bank's comfort level range but policy action is unlikely due to rising global energy prices,https://www.cnbc.com/2026/03/12/india-february-inflation-cpi-oil-hormuz-risk.html,top news,
2026-03-12T10:19:26+00:00,Russia's Rosatom says it will stay in Iran despite war - Reuters,Reuters,Russia's Rosatom says it will stay in Iran despite war  Reuters,https://news.google.com/rss/articles/CBMipwFBVV95cUxQNDJlc2hQSjg1WDJ5R3dfTkxmQm9MTHZKaXY4VW9zRzIxbkNLWThaVUZSN0tpWm9IdEN3T2hUdXczaUpLSkFlQzF6N3NqcXJHWjVxV0wzLWp3MEJrTmZZcTN0bVZZbFJlYVVOSGtwX1BNME1rdnhqSkdPdnl6T1FLSm0wc1RRMnZCVFlzcTZ3c0hsMkpKZlJYZ1N3ZGZrN1ZoeFMzbWVQWQ?oc=5,business,
2026-03-12T10:19:09+00:00,Why gold hasn’t moved since the Iran conflict — and where it could go next,CNBC,"Though the war in Iran has continued for almost two weeks, the price of the yellow metal has barely moved.",https://www.cnbc.com/2026/03/12/gold-iran-conflict-where-next-markets.html,top news,
2026-03-12T10:02:46+00:00,Wall St whisperers help financial firms navigate Iran conflict risks - Reuters,Reuters,Wall St whisperers help financial firms navigate Iran conflict risks  Reuters,https://news.google.com/rss/articles/CBMivgFBVV95cUxPYUZVTzBUeWUtQ0NicC1OcUQ2S09kMEN5SkhVQ3hZa2RyZEpKdUlJdDlpT2s1bk9uS29xeldJX3BMeVNKMTRJR1o1a25iZzB5V2lXMlZHaUdmNEhlM2t6ODNiOWtZRnJ5cV82MDdVRVVxdU5JbW9mWXVoVHlYQ1J6NmlEaVdMcmpzLWNMRFQyV0psc3JLeVJsX0tSSjlTTGxHWk1STFpXRTJBWXBjSFQtdUotUlhndXFMN0tKc3hR?oc=5,business,
2026-03-12T09:03:55+00:00,"Iran war unsettles India's packaged water makers as bottles, caps get pricey - Reuters",Reuters,"Iran war unsettles India's packaged water makers as bottles, caps get pricey  Reuters",https://news.google.com/rss/articles/CBMi0wFBVV95cUxNMncyMWRLZVhtaGNuMk16NVlsQVRkYXJFMWVaT3NMcXA5UmxOMlNERVhGZnZpRExteURpc05QWTFOZ2h4SWtid2xYUTR0a0l2N1N6dXV4ZWhUQS1telVRQUkzbjVqUXlEeHZIaGZoSUNqbGM3aHpPbVVZRHZ4bGxGb1p3Ukp6dThPcVJpNmJMVTJIZzhsaC0yUEszUi1XTnFlUElEYlplV0tnY09PWGlLU2pHYWhqWjBPT3VweldsNEtGMXdrSmdNNncxV0J2VHJHaDhR?oc=5,business,
2026-03-12T07:21:27+00:00,"Iran war may embolden BOJ's hawkish push, despite growth risks - Reuters",Reuters,"Iran war may embolden BOJ's hawkish push, despite growth risks  Reuters",https://news.google.com/rss/articles/CBMitgFBVV95cUxObmFqM3djLUkyalctSXBveDJfaExaaUs3Rl9WR2xVejM2eUxpaVpPbncxaU9nYlFGd0FxMm9vU0FKRTIxODZDZkFLQzIzaXBoeF91ODFmdWtraUstaFNmc0NQczlOU2FHWG1KODhSbW1OdWJuSDN4dGExM0JPaUpmRzFPV19rWGc3MDQxbnl0TjVyRGNmcjFmVEQtUW5ZMXE0REoxYXVmTk8ydXJUMjR0Y19IZkxvZw?oc=5,business,
2026-03-12T06:29:00+00:00,"Airstrike on Italian base in Iraq was deliberate, defence minister says - Reuters",Reuters,"Airstrike on Italian base in Iraq was deliberate, defence minister says  Reuters",https://news.google.com/rss/articles/CBMiqwFBVV95cUxOVTJTc3Y2Q3V5c2pCX21OOHFlS0l4TW9PQWp0NDlFUUJpNmxjWTdaT2ZCM05iM294VlJydWZnb3g3R3BhM1Z5ZVJ3WHA3VkNnNTVRdzhfbGlkNDhDWVlNRDdLSXZEZVl1NG5naEtNLVZQX0Z3QV93MEZzZUJhdjRXTWt3ZVFsbGxiRWFFRWpIN0xNYnpyS1VlZ0VBR2xic1pOQ3Fvd1JrMkdqZzA?oc=5,business,
2026-03-12T06:13:00+00:00,Is Europe's gas demand recovery derailed or just dented by Iran crisis? - Reuters,Reuters,Is Europe's gas demand recovery derailed or just dented by Iran crisis?  Reuters,https://news.google.com/rss/articles/CBMiwwFBVV95cUxOQkR2VEhnOXNJMHlOaWRtSmJPUzJsSkQwUmtIckUtXzVpYkZyRUFPMWtsTkRyNHM2bEc4RV9YLTdOWjNFR1VXMlMxVkpfWl9nSjJWeUliVG1RTUFtRnJ3VXZtR052Ui1kdHlwajB0Vm51UUxtci15TWtGTUZjeTRmTEJUU3kwRGh5M0NBQnJ4NkhSeFRkeGJ3Ym5fam1sUnJubVhIUWw0SzA3eWlUeDEtMUFva1Y3SmJLdGlJb0VGNDZTNzg?oc=5,business,
2026-03-12T05:54:00+00:00,Indian source says Iran to allow India-flagged tankers through Hormuz as first tanker arrives - Reuters,Reuters,Indian source says Iran to allow India-flagged tankers through Hormuz as first tanker arrives  Reuters,https://news.google.com/rss/articles/CBMixAFBVV95cUxPZmVyWE1BTTllX3pRQjU4Sk9fMzB2aFRmLW1ucl9DZzJDcUVkek8taTc2S0hXZHFnclNhVWxaRVpWQzVBc2k1emJDZGEwMGo4RnI2dnl2MzV5RTl3dzltTXRsZVVva1BqRFdGVExoc1lMSlI5LTQ3dTlzbm1mTjFhN1Bua0J2Sk45QzRMUS1BdWNpX0k0R1dDOElqclBhQnhEdGI0NU80b3VhdTc4cnpqLW5Ebkwtc1hOTkdVcE9UZlV1dlRS?oc=5,business,
2026-03-12T05:33:00+00:00,"Morning Bid: Iran widens war on shipping, Trump talks Strait - Reuters",Reuters,"Morning Bid: Iran widens war on shipping, Trump talks Strait  Reuters",https://news.google.com/rss/articles/CBMijgFBVV95cUxQSDlyVWVVMnBNbVhtczl3SlZaVXFWSnFOeUxJaDJpQkJqWVZZQWxNTWVXdVhKdklHdnlYLXVINmg5Y0ktaVZUTWhTeEc5Wm8wS00tMTVJZ0pCa2xwN1dyWl91UTh5Y0FTenVsZFdGbjBIZGZ6Rk1LbzdVSklYZkIxYy1jMnRBZk96ZXB4U0VB?oc=5,business,
2026-03-12T03:36:00+00:00,Iran World Cup withdrawal threat leaves FIFA pondering options - Reuters,Reuters,Iran World Cup withdrawal threat leaves FIFA pondering options  Reuters,https://news.google.com/rss/articles/CBMisgFBVV95cUxOV2o2QXVJSklmYVRiUVdJeElDejlVMzBueDdJMUt3X1A3Q2FUZEFSZnZpQ0c2amJVZDhaNlQ3UXdKX0pmekpJbmFQQ0hzbDJZeVBzZmg1RURsa3JjdTZzZjRBc3RUdXdxbU1HVDFETzV3WW9valNpajY3RG1pcnlqMS1jMmFPNkl0VmNoem96YVpRWWg5dS16SlFQbWJkajdhWThMZGI0bjltUEx6SUJxcjBR?oc=5,business,
2026-03-12T02:52:00+00:00,Samsung Display CEO warns of cost pressure due to oil shock from Iran war - Reuters,Reuters,Samsung Display CEO warns of cost pressure due to oil shock from Iran war  Reuters,https://news.google.com/rss/articles/CBMizAFBVV95cUxNcWZUU2d1N3ZVcmlkU0EtcXJicDZGYmtlNG5DNWFmcWNYZ1kzYThta3k1YkN1b2JkM3FvNmxDM2lhYm93NS0yNnBjbVo3eHBqVklmWm5KNXZBYW5GWXdZVnJLTUFhTzVNTFctdFZRY2lHc2l1ZFl2eURXYkZBYWY0WHJES0U0VEpxdU50RlhlbEZjN0FFQjlJU3ZSN1dBOGNGanhyc0RZM0h5dl9XQnBOV2FCU1JWS2p3cDlOX3ZOOE9oMU1aU2RxNlhINEo?oc=5,business,
2026-03-12T01:30:00+00:00,Oil jumps 7% as Iran escalates attacks on Gulf shipping - Reuters,Reuters,Oil jumps 7% as Iran escalates attacks on Gulf shipping  Reuters,https://news.google.com/rss/articles/CBMiuAFBVV95cUxObUlmTHZTREdweklZWFUzeEp0dzFUbk56bWVQQ3hWY0IzWDlZN0JzUllPUmJyd3U2RVZVUHQ3SE5DcFBSZmVNYlljWEJYTVpRTlVISVFKTWoyR2Z2aEVrQ0dVU3RKc1lhay1QWG5TVlltdHB1YVFRNHFpemRxalFyRk56andqamRBVHBJVmwwZTFkcDh4c1NuNFloakZRX2xHSnlyRTgxbkVycVVTUjBWS0pyV0pmMjVW?oc=5,business,
2026-03-12T01:28:00+00:00,Oil tankers burn as Iranian strikes defy Trump's claim to have won the war - Reuters,Reuters,Oil tankers burn as Iranian strikes defy Trump's claim to have won the war  Reuters,https://news.google.com/rss/articles/CBMitAFBVV95cUxNWFYxQndsWXVzNHlRUEZnQjFsV3Rqd01Fa19DQ1FneEozRm8ybU1SQkJfeGxYcDREZW50cUl0aXE0cUtvLXB6UlNNQ29WNDdSa21zVG5walBZT20tS21oZFMyN3BLSVBRU05xRWtGZmZEaGstZHdoMFhCTmcxb29QX0JUbjUwY3d6dUVTWFJpNi00M3hfc3FDM3E0S3dWdlpMSVVJSmNlTzVlcTVCMUNXWmJJV3A?oc=5,business,
2026-03-12T00:50:00+00:00,"Oil jumps, shares skid after attacks on Gulf shipping - Reuters",Reuters,"Oil jumps, shares skid after attacks on Gulf shipping  Reuters",https://news.google.com/rss/articles/CBMigwFBVV95cUxORUE4amVlSWZrMjBnTVZzZUZmMzZ4eVZLbVlybnI4Q0xQYUxnVEZCRDJwRjlnZFVkcEdsTmw3dUZMYTRYTVhKbmdNZzRTdU14VTRqMjNxaS05OFJsQWI5V2lhRVllcFBJbTRJQUdyV3hWNGJQUlcwMnZqZktrUlhzOU0xVQ?oc=5,business,
2026-03-11T23:27:29+00:00,"Google sells partial stake in fiber business, becomes minority owner of new venture",CNBC,Google said its GFiber unit is combing with Astound Broadband and forming a independent fiber provider.,https://www.cnbc.com/2026/03/11/google-sells-partial-stake-in-fiber-becomes-minority-owner-in-venture-.html,top news,
2026-03-11T23:07:31+00:00,"Exclusive: US intelligence says Iran government is not at risk of collapse, say sources - Reuters",Reuters,"Exclusive: US intelligence says Iran government is not at risk of collapse, say sources  Reuters",https://news.google.com/rss/articles/CBMixwFBVV95cUxPVkc0amxITVJ2TWtxcmtBdTRsWTNFTnBXazNQcXh3UHJrV2NUNEZobERQSE5GUXV3dWMtTzFOYjJ6aHVRcUcyTkt3WjZMZGJnQ2RQRFNkM0QzOFlsT0NUeHkxcHZTcHBSQTg1ZDdoeDNjV29pSWhuU29vSnB5UTlsdU9nYl9pQ0JoTk1UQ09CRmo1ak5lbnBLNXJVY19YRC03VlJFdWdtOGVYMXU4MlVVeXBuQWNMRmN5Q0I0NXlGMXFZSk9QV29V?oc=5,business,
2026-03-11T23:01:49+00:00,Jim Cramer says these 3 stock market themes could work if the oil shock eases,CNBC,"Once the dust clears, the ""Mad Money"" host said investors could look to AI data centers, memory chips, and discount retailers.",https://www.cnbc.com/2026/03/11/jim-cramer-says-these-3-stock-market-themes-could-work-if-the-oil-shock-eases.html,top news,
2026-03-11T22:19:42+00:00,Iranian oil flows through Strait of Hormuz even as Gulf neighbors' exports shut - Reuters,Reuters,Iranian oil flows through Strait of Hormuz even as Gulf neighbors' exports shut  Reuters,https://news.google.com/rss/articles/CBMiwgFBVV95cUxNZlhjS0JINWtJZlRsZzVnZHB5RHB2ZFlGWms0NUNNRTd3cGZZUXhTYlNsd1NWSnNLRnk1Z3RnYmtKT2pESi1YSUNzaGwzS04zRjNQNE1nNldFcDRYd0ZnaU5xTXNmNVMtUXpjNXI3ZWhrbVJkRS1SOGJvRGFJMUI2MTVvT0lzSklLNk9oenM2VkhFYlo5bHBtSzR5cm5WVzNYS2duQWNLSWRzRTBhaWxGd2hZSEtDUVZJZkZ0aW1QelJDZw?oc=5,business,
2026-03-11T22:02:18+00:00,"Trump administration estimates Iran war cost at over $11 billion in six days, source says - Reuters",Reuters,"Trump administration estimates Iran war cost at over $11 billion in six days, source says  Reuters",https://news.google.com/rss/articles/CBMivgFBVV95cUxNZms1Uks3WlkteU9PX3BWWlVWTm56Z292b1lKZmlLM1o2VlZpZGZ4bHFUbjFrWmdIWVlULUNCMW51eXdBZElxZEtic0VSSjFEQjRLanB0dUJlTFpJUWRXRURqZkFDdWxoM1lZdHNocWhuWkpjNnJXNVc2WTFYSmUzMzl6N2ZkTTQ0a3liVXFvU2hKekxjUjRwU21KR0RpZkRJblFqa1dBVU9tcU1OeWEwQ1Q3U1IzbkRlSXJKVm9R?oc=5,business,
2026-03-11T21:43:21+00:00,Atlassian slashes 10% of workforce to 'self-fund' investments in AI and enterprise sales,CNBC,"Atlassian said it's cutting 10% of its workforce, or about 1,600 jobs, as it restructures to fund investments in artificial intelligence and enterprise sales.",https://www.cnbc.com/2026/03/11/atlassian-slashes-10percent-of-workforce-to-self-fund-investments-in-ai.html,top news,
2026-03-11T21:26:28+00:00,"Trump on Iran: We won, but don't want to leave early - Reuters",Reuters,"Trump on Iran: We won, but don't want to leave early  Reuters",https://news.google.com/rss/articles/CBMiiAFBVV95cUxPTDhfS01XekFFWE1pSEtiT2c4aDB0dk9hZzU1THdiOHNpYUhua05yT0JsTlVOX2Q4SFRvZnRtdktRN1R6Z0gzcTdrR0RhdEZ4UXllWkFST0stSFRWeGFOS05PSjNWc2RiOGN1NXRLR0d2MFF3OGI3UWNNaUNHend3cjYtb2YyaEhj?oc=5,business,
2026-03-11T20:33:07+00:00,Sea drones target oil tankers in the Middle East as conflict risks widen - Reuters,Reuters,Sea drones target oil tankers in the Middle East as conflict risks widen  Reuters,https://news.google.com/rss/articles/CBMitwFBVV95cUxNNTlodkV3eEVSa3p3eTR3RFNFRkFGb0dHcmVGR19DbWZseXpSTjhnOTRhaEx6SzBPR3ROR3VlWTFCMy1FXzg5OHpGWFByZmxldVJ6THJlRXJwUENUMW0xdHV1WElfbkhXUUdCY2ZFbXVib2p1M3lJOWdqeHlXak0yM1RfNlJLWmxqZWt2STdzSy1DVE9Ub1RzUklaTV83a1lGM2hJUFpSVzlUX1hqZzY5SGlCemVaMjA?oc=5,business,
2026-03-11T20:25:03+00:00,Nike lands an 'unconventional upgrade' from Wall Street. Why we're still believers too,CNBC,Jim Cramer says Nike is still worth owning because CEO Elliott Hill's turnaround efforts have shown signs of progress.,https://www.cnbc.com/2026/03/11/nike-lands-an-unconventional-upgrade-from-wall-street-why-were-still-believers-too-.html,top news,
2026-03-11T19:18:34+00:00,"US may have struck Iranian girls' school after using outdated targeting data, sources say - Reuters",Reuters,"US may have struck Iranian girls' school after using outdated targeting data, sources say  Reuters",https://news.google.com/rss/articles/CBMiyAFBVV95cUxOZFdPV09fUWxMekpFaEVvYnBNTG1xOVZtNk9hZUpFNHptM0I0X0dOVkV3YmhzY3pnS2U4WWR0VnJiVjJVUGRCZ2dMalRydm9XRWx2bjhJaWNPTW9RdzBRWDhaR21sb2hzMkxFS0pwTHpBUUliblZUUEF3X3RQTjFURzFmdks5bmRkd2NoUVFQdDA5OFRXOFg5NE81N3k3OTVNTDRNLXJxTE5OXzBrcVE0WXQtSkFkV09aOG5vcGp6ajlINWZmTTJLSQ?oc=5,business,
2026-03-11T18:57:57+00:00,"US Senate Democrats want answers on strike targeting Iran girls' school, civilian casualties - Reuters",Reuters,"US Senate Democrats want answers on strike targeting Iran girls' school, civilian casualties  Reuters",https://news.google.com/rss/articles/CBMivgFBVV95cUxPeHRyS0tFOUJ3cFM1ZENvREN4VEx4eEFablFJeHEzWGo3ZFVkd3dGZ2dJNTVSWFpxV25YS1VTUEJrZER0SkZkOVNFQll5elRmWVpEbWYwb1FfVEZtZlZrU2NBMVNVc0FiVThXMmZlYjF5bmhCcXUwS0FaTzBEM2dsenJwajZ2TUZRNHpjZC12TGxiSlEtRFdMcnJndjgzNU9KU1MxNDBQNnhmUWZKenRNdGtYYVpkSl82RG84ZmRR?oc=5,business,
2026-03-11T18:37:48+00:00,"Why Gulf fury is aimed at Tehran, not Washington - Reuters",Reuters,"Why Gulf fury is aimed at Tehran, not Washington  Reuters",https://news.google.com/rss/articles/CBMinwFBVV95cUxPV2ZROHRvbWU0czBJdVFKd1YzNE9LQWNFLThxekxJZTlnRnlrZEE0ZGduYTFmdEFzTEg1RDdLTVJMaEQ1QXByeGVoSHhlbmlIdVRITzZWeFBNSXB0V2lvODdNM20xZjhaQ09nNDFNcnVLTXVhbU42dE9ETmVXQm5na2QyYTdGQ3VJbEtHMVJkYmRfTmp6d1c5TFpyVFFWQ0U?oc=5,business,
2026-03-11T18:09:10+00:00,FBI bulletin warned of possible Iran retaliation on California targets - Reuters,Reuters,FBI bulletin warned of possible Iran retaliation on California targets  Reuters,https://news.google.com/rss/articles/CBMitwFBVV95cUxONGNhNTNBSUdDOHNEWkdSa3NKMlpucm1SNm9SRUxKNW9KSzFZV2hoUEdGSThGQUFCOTZCdEhCRmVNWVZKY0xFTDZ2LUJ5RzJBWVgzM2tsbHNWZG16ZHRNR1BDTGwwLUVYNXpqMldMN21QRG5qcGJYdjdEeWNUM3hiZFhyOEdyYW9RRHl4WnRGQ2NPX0JzeVFzMERNRnRYb0NNeW5iSE93NHl2QkFrTW1VdXlyd09xeGc?oc=5,business,
2026-03-11T18:08:06+00:00,Food prices could rise as Iran conflict disrupts fertilizer supply chain,CNBC,"The Iran conflict is disrupting fertilizer shipments through the Strait of Hormuz, raising supply concerns and potentially increasing global food inflation.",https://www.cnbc.com/2026/03/11/iran-news-food-prices-could-rise-due-to-fertilizer-shortages.html,business,
2026-03-11T18:04:09+00:00,Chubb to serve as lead US insurer for Gulf shipping amid Iran war - Reuters,Reuters,Chubb to serve as lead US insurer for Gulf shipping amid Iran war  Reuters,https://news.google.com/rss/articles/CBMiqwFBVV95cUxNYUdqSUhsdXFhYk9Cc01nNXJENU5GSW1BeTFmYlFZR05QOTF1ckxDNDZjNUhPZHowUDJsNEVaRlMxemoxb1lYRmd3UzBBem5rYVIzWEwzU1JReHZDdFhJNHZqS0NPdUt5RWhpdUNqbC1MM1ZibTItYlJBcnNjUzFtQUxLQmxYUjhrTURIUDJ5aDc4R01rel80cWlJSTg0S3RRcmxvS1B0ckZyaXc?oc=5,business,
2026-03-11T18:00:50+00:00,India ready to support oil markets as IEA agrees record release - Reuters,Reuters,India ready to support oil markets as IEA agrees record release  Reuters,https://news.google.com/rss/articles/CBMirgFBVV95cUxOUjh4VmpuTnZMalZuWm00UzVZT3NSdjE3c2lMc0ZxVXNOOXZJaW03a1M0VldLTFd4Wkl2elBqVDM4Rmo5enZuc0x2MXlYbEIzenZLSnhpZHFqZy1zTVlTUkYxYXRiSi1YdFcyeFpWaW85bC1TODJkQ2F5YUlXeml3VkVzbmlaRjdFMDZkOUFjaHdPeVItVHZEOU1NZ2N6M29FWEIyVjg0UFN3ckNLalE?oc=5,business,
2026-03-11T17:48:15+00:00,Canada oil producers say little can be done to boost oil production in the short term - Reuters,Reuters,Canada oil producers say little can be done to boost oil production in the short term  Reuters,https://news.google.com/rss/articles/CBMi4gFBVV95cUxNSThxSXB1NEhjTEkyNks3aV9xUzlXVWRSU2RWTFUxSzZRZUo2a21fMkwyR2xOaTlvQ3N5T2dqT1J4eWF1eklBcWpYY3dzSzU3M3lTSVhqVWpMWGdNNms4cDhDbm9wNk9FZmVsdXlDWkowS3V4NWFoLUtWbmIzai1zVUN2cFFCNjVndVBXMTI1bG9ZY0x5X1FCRXJuUEZfU3FydjB0Q0Q0UmlHRDM5aVI4TlgzSGxvQlNhOWZoOGxnWUtKY20yYnFVeFFDdUtZakFmS3ZuRmtSSFVueGxDVEQtSG1R?oc=5,business,
2026-03-11T17:38:11+00:00,US gasoline prices surpass $3.50 a gallon at the pumps - Reuters,Reuters,US gasoline prices surpass $3.50 a gallon at the pumps  Reuters,https://news.google.com/rss/articles/CBMirwFBVV95cUxPQ0pBUmN6cHlfMnJqT0RKZEwtVU1zc0pBN2xQZmhvWXU5RW9md2RSVmdRR2JvdHlfS2ZkVE9feG9fTndnc3NTbWpKZEl3ZXNmX2NSVTRtemc3WUdZVE1TR3hOLVdBNlRqdUpqbFVBVjRWbmVOVUNhamg2a3l1Y1lUQm1TNTNTM0xBNnRQX0NqeDd6eG5DT2xWTzdWeWZNVE9TRkY4eXJ6aEhzX2d6d2hv?oc=5,business,
2026-03-11T16:40:02+00:00,Jim Cramer says Eli Lilly has checked the most important box as obesity pill approval looms,CNBC,"The Investing Club holds its ""Morning Meeting"" every weekday at 10:20 a.m. ET.",https://www.cnbc.com/2026/03/11/jim-cramer-eli-lilly-has-checked-.html,top news,
2026-03-11T15:57:13+00:00,"Iran has laid about a dozen mines in Strait of Hormuz, sources say - Reuters",Reuters,"Iran has laid about a dozen mines in Strait of Hormuz, sources say  Reuters",https://news.google.com/rss/articles/CBMirgFBVV95cUxNNUFIQkFxWlZhbjA4S0h2cGVwY3puZkhSOUFVRjJFWGs4QkxFSVRSMEtuS0Zsb0p2QzF6UWtpMEU5MFI1MUVMTTR2b3BaOFpJUDJsS2g3NW5vWnhkSkJpOXY0Uk5HUmRFMTQyV2FfMjRDblBidXRlRXA4VXk0UXFXSGJMR1REdEVrbllrcFpjTEV5c1RsNEdqak1kLWF5ZkZRaUIzTDk3MlIxaWtDVmc?oc=5,business,
2026-03-11T15:43:09+00:00,We're buying the recent drop in a recession-resistant stock that started the year hot,CNBC,"After sitting on our hands Tuesday and awaiting further developments in the Iran war, we are putting some money to work",https://www.cnbc.com/2026/03/11/were-buying-the-recent-drop-in-a-recession-resistant-stock-that-started-the-year-hot.html,top news,
2026-03-11T15:26:09+00:00,How Strait of Hormuz closure can become tipping point for global economy,CNBC,"A Strait of Hormuz closure due to U.S.-Iran war hit the oil market hard, but sectors reliant on shipping across economy from metals to farming are vulnerable.",https://www.cnbc.com/2026/03/11/strait-of-hormuz-closure-shipping-economy-oil.html,top news,
2026-03-11T15:16:57+00:00,"Gulf trio review sovereign investments to offset Iran war impact, official says - Reuters",Reuters,"Gulf trio review sovereign investments to offset Iran war impact, official says  Reuters",https://news.google.com/rss/articles/CBMizgFBVV95cUxOUFRVRWFDSks5Yi0xTGVHYnlhUDNtbzRLQzlqZEdhMVVvam5OYlFXUE0zejRJQi15N1p0U2JNblpNcTF2V05kd1dZeGhHdVU2Zk5sRktvejJ6QWR1RlM1bXMwWEZVX3VYZmhPNjJmdVF1VFRCYkZBQzhTS2IxdnRiaTZHSnczcTZlcEJWLWtZS3h4RUZmcEk1YWdSYnBBUURISFNWbWhUWkhjaE5Fbl9fMllGamExcnZTZm80OEFWVTc3SWVvYXNfeWYtOHRDQQ?oc=5,business,
2026-03-11T15:14:27+00:00,Iran-linked hackers claim responsibility for attack on US medical device maker Stryker - Reuters,Reuters,Iran-linked hackers claim responsibility for attack on US medical device maker Stryker  Reuters,https://news.google.com/rss/articles/CBMiswFBVV95cUxNSUJ6bWpFRE5SclZaejZILXdULURjZERPY1JENVdHVDJXRW01cXRQRjJwRFpYMWt4enhfcHFxUHBtbU5nb3F4VEJBMVVwbFJZbUhpd1QtRjFrWTRWZFZjVzN4emxwSFRDbWtSTWFuS3ZxcjJpX3FNMDlpdFVJMzJJd1dnZkUwQXQ2M2pjaVRpSF9ZX19nUmx2S3lxb1pxaEYtTUI4NzREV0RyN2gwS3FLNE9SWQ?oc=5,business,
2026-03-11T15:10:37+00:00,U.S. military tells civilians to avoid port facilities where Iranian navy operating - Reuters,Reuters,U.S. military tells civilians to avoid port facilities where Iranian navy operating  Reuters,https://news.google.com/rss/articles/CBMivAFBVV95cUxQNHMxVnc2bVlzYmpKdkhyUGV3R0R1WHR5OGwxVVJIZl9GM3QybmtZMGhhdmJXNFJnRXppYVdxNlFFZHhKdnVEeUlnUkp0TWR5Z0EwX0d3MXVxVmswYk5ORktaaEVoaHpfSnh1YmJjcHBaRkFyTlFtai1iUDZta3NNMXpCYVBIYjhXbDh1aVhwa3lXMHB3SDRoYXU1d0lMLVlVdGF6Wl9UM2Y5emQ1cDJiYWd4YWVrOUNScmVJVw?oc=5,business,
2026-03-11T14:31:03+00:00,Turkey's Erdogan says Iran war must stop before whole region dragged in - Reuters,Reuters,Turkey's Erdogan says Iran war must stop before whole region dragged in  Reuters,https://news.google.com/rss/articles/CBMivgFBVV95cUxOMms4NjZLU2FfaXZ1ekVTbC1SVTFSLThxaGtidGN5ZmQ2aGdPakx3TkRIb1lWMFlqeDFSYlRRN1BYNm5Pam5BOFhFR0lXUzlaV0VMbHVjcmRnbUl1dy1SWDljeHJxRDFoZXRWdElJQTV2UmJkVndQd05iMXdBRUxwYW45ZXNtLU1faV9BRXNfeTdxcDRwdUhHLWlFMGhLa1JPbGk1d2tVQkpZRUtXaHNtcUZhQzZyS0JqNG5iTFpB?oc=5,business,
2026-03-11T14:13:42+00:00,How many ships have been attacked in the Gulf since start of Iran war? - Reuters,Reuters,How many ships have been attacked in the Gulf since start of Iran war?  Reuters,https://news.google.com/rss/articles/CBMitAFBVV95cUxNOVhQNmNNSjdqQ3dWSVdqTUVvbDdtd05MbzlJdXhVeHVrbFd5MVZDOEVpR3VRV2NtcnBpa1BFeFBtQ2twbHp4TGEyUklFejhlTXY4dEIxckV2cnRkNlE5U3JjdURacVVhZVFxYWVLUlp0Njc0RGwtUXFIMmdrTXdrdVp2WFJ4QkphV3BUUkNwaHdneEthTTNocFJUelhDYnVzdk9OZmlvUmdRa2FYVTV2aDNGb0E?oc=5,business,
2026-03-11T14:09:49+00:00,"Trump tells Axios war in Iran will end soon, 'practically nothing left' to target - Reuters",Reuters,"Trump tells Axios war in Iran will end soon, 'practically nothing left' to target  Reuters",https://news.google.com/rss/articles/CBMixAFBVV95cUxNa2wzLUotdXpQZDBtTHFwc2hMdVNLcDhQeUliclZlUTZRSjBOLV9PZ1cwTHJkLU4tcG1LVkJ3cmZ3S2h6Z1cxcE1HdWsyVnc1YmZJRGVXSUI5dm8wRjNtYURlYU9IVGhhejBXRVJ0Mk9UUDZwcXd2ZGFVdWo2MDdvSEpab1hsN0xpb3NLeUUwazQ0Um5QUFF0YnJ2UmNoWld5eXBTamtVSVhnUjI5N1dNT3p1Sm9JakFwTE85Wl9sNkxacDF4?oc=5,business,
2026-03-11T14:03:30+00:00,Oman works to contain fire at Salalah port after drones strike - Reuters,Reuters,Oman works to contain fire at Salalah port after drones strike  Reuters,https://news.google.com/rss/articles/CBMiuwFBVV95cUxPMzc2cDlUcmZqYTRYTTllRWM2bUU4Nlh4emdnT3QxRm9Pa3pFU2NQWFBSbkp2TnRfWXNPYzlyR3NwNFA2cXhMNmx6bHYyekxQbHpvUF9ya2VZU0U0WDhLUHdLQnlSZlZ4MTl5M3B0WFZyU1BxWkxlV2xZUW04cllPcHBXbVFmSnVqT0pUOUJXaTJVSGtxeGxXWGVsZmRrdG1TTG10SzFRcmFsTW5pcDUwRUJRUHFZUEZGQjlR?oc=5,business,
2026-03-11T13:45:14+00:00,"Iranian women's soccer squad member changes mind on Australia asylum offer, to return home - Reuters",Reuters,"Iranian women's soccer squad member changes mind on Australia asylum offer, to return home  Reuters",https://news.google.com/rss/articles/CBMipgFBVV95cUxPYWZvVFdtRnprOXMwMzVVMTdDY0Vsc0lYZ2N6V3h2RG1YalVwQXQxdlNKYTVXckJhMDlfWkpTU2wwU0Jzeld6OFNkMjRGaDBXVy1VX3lFV0NnOUJmaHFueVRkRERXYW03XzV4YUJHTzY2OUdpLUdnVXE2Znl4X2JScXJiUlB4ZHNRTE1FTnRNSnZCMDJLSHMwWU10WHJ4UVNqeXpDOG1B?oc=5,business,
2026-03-11T13:30:01+00:00,"Black women were disproportionately impacted by DOGE cuts. A year later, they're rebuilding careers for themselves and each other",CNBC,Black women make up 12% of the federal workforce and experienced the largest federal employment losses between 2024 and 2025.,https://www.cnbc.com/2026/03/11/black-women-impacted-by-doge-cuts-are-rebuilding-their-careers.html,top news,
2026-03-11T13:29:43+00:00,Interior Secretary Burgum calls for IEA to release oil reserves to address supply disruption,CNBC,"The Iran war has triggered the biggest oil disruption in history, as tankers are unwilling to transit the Strait of Hormuz because they fear attacks.",https://www.cnbc.com/2026/03/11/iran-war-oil-iea-strait-hormuz.html,top news,
2026-03-11T13:26:24+00:00,Instant view: February inflation in line with expectations as Iran war overshadows last month's data - Reuters,Reuters,Instant view: February inflation in line with expectations as Iran war overshadows last month's data  Reuters,https://news.google.com/rss/articles/CBMixAFBVV95cUxOWjFPUTJRZExCam9pcFFfYkJkOFVHbXZUNmtHOEZFdzZTNWI2WXJyelFiYjJ0LW1XdE9OZzdWVVRjaUw3TlVpbXl5NHdjZ0tfbTNOYnNXUWMwQTBDZWJiR1cxRVQ3ZzdEckhLY2NuLUZyZm9SOHdCWTFNWUhNNVlYVW5jS3ZnbVF6X2I5Z0poMFFoWi1lTjF5VXVlcVFVb0c4cGpLRXMxNnBBcGNmMWllMEkwUm1Wd0lRQ0FtN0diZi1LM3RS?oc=5,business,
2026-03-11T13:08:16+00:00,"Citi, StanChart evacuate Dubai offices, HSBC closes Qatar branches as fears grow - Reuters",Reuters,"Citi, StanChart evacuate Dubai offices, HSBC closes Qatar branches as fears grow  Reuters",https://news.google.com/rss/articles/CBMivAFBVV95cUxNYklVQ25lZ2RWX1FEczlDR3VmNmNEVVFSQkYwSDlMSUdvMGJPUE1GQlhQb3EtM0djd0x6U1BfSzY0TVFXOE5vLXlGTkZQMVZLWkowU1FCRHI2R2lqTTFPcmV5dEVoZHZvV0Z1NThZY0g0N2M1MEVwRnBMeTJHT2k5Vm80XzRUeHgxLVAtUWVxbVRfTzVMSjFmdmx4TGwzQVB3SUlQUmhvUC14V180MUR6blJMM2l2TmFmampnUw?oc=5,business,
